text	category
 Manushan epudi vanthalum tharama irukaru ya... THALAAA... This time CLASSY After a MASS VISWASAM....	Positive 
 sivakumar ah villana potruklam just miss	Positive 
 Viswasam vs Petta pakalam yarru mass nu	Positive 
 U1 bgm Therikudhu.... Siva ku Nalla movie ya erukum... cameramen George c villiams SEMA	Positive 
 Intha trailer ah daily pakaravanga .....?	Positive 
 Enna da ithu trailer ah Serial ah	Negative 
 Kerala ajit fans like ittu po, ejjathi item. Be ready makkale🤩🤩	Positive 
 Orutharmela neega viswasam MA erukarthuka Enaurutara a asigapadurega	Negative 
 Oru Vela ellam avan seyal padam maathiri irukkumo?	Positive 
 Manju waarier looks like devashena u feel it guys	Mixed_feelings 
 Theatre la pakura alavuku worth illa....suntv laye poduvan appa pathukuren	Mixed_feelings 
 Waste Moka nu solravanlam Moka pasanga moka movie paakuravanunga	Positive 
 Avara control panunga pls semmmmmmmmaaaa mass	Positive 
 Ethana per vanthalum CHIYAAN tha maasss	Positive 
 Very good film after long time	Positive 
 Thalapathy fans irukingla ..dislike panra kaaga ve vandhavanga ...	Positive 
 Amy Jackson pakka vanthaven la like  podunka	Positive 
 Vera level trailer great job mr.vinoth	Positive 
 tmrw film release.. inikum trailer pakka vanthavinka yaru	Positive 
 Trending likes laam mukiyam Ila padamum acting yum dhan mukiyam theater la October 4  apo papinga	Positive 
 Movie la ajithku theeni irukathu pola	Positive 
 Idha dhan pala varsham ah sollitu irukanga!!  Ini otrumai ah irukanum ellarum. . . Thala & Thalapathy fans!	Positive 
 Trailor pakkum munnadi kooda onnu thonala....trailor paatha aprm epoda paapomnu veri mandaikku eruthu............This trailor Advance booking for awards.....	Positive 
 1:40 Vjs Jithu Laugh  Makkal Selvan  Forever	Negative 
 After release # kaithi vera level #diwali winner	Positive 
 As Neelambari said In Padayappa Vayasu analo un  Stylum azhagum Une Vittu Pogala	Positive 
 vijay sethupathi nu oru nala actor irundhan ana avanum ipo poramboka maritan	Negative 
 ENNA DAA ELLAA  RECORDUKKUM SANGU  OODIDUVAANGA POLA    THALAIVAA   SUPER	Positive 
 Ayayo bigil aprm release panratha idea iruka lokesh gaaru 🤒🤒	Negative 
 Nee vaa thala namma therikka viduvoom	Positive 
 U kena tunggu lama lagi utk tau saya	not-Tamil 
 ada paavi....appadiyae batman copy adichu vachirukingalae da	Positive 
 Daii ellam likes me comment pannunga da	Positive 
 0:46 kathii trailer feeeel adichavange like......	unknown_state 
 Thalaivar vera level!!! karthik subbaraj yenagaya iruntha ivalo naala.... 02:00 Kola gaandla irukkam mavaney kollama vidda mataen insaneeeee :P	Positive 
 Video pakaraduku munadi like panta..sama trailer	Mixed_feelings 
 OK. expect panna levelku illa but ok	Positive 
 Siva sivan kjr hero trailer pakka Arjun arjunan ps hero mitran super  Saktimaan sakti 90#kids like and comment	Positive 
 Elaam songs ku dhan addict aavaaanga... Naa enna yaa trailer ku laam addict aaitan.. Can't wait...	Positive 
 Semma semma semma semma thalaivar super star	Positive 
 Rajini+sankar+a.kumar+rahuman excellent job..waiting on screen thalivar fan..	Positive 
 Chinna payan konjam ovaru Ana trailer nalla irukku	Mixed_feelings 
 Alaguuuuuuuuuuuuuuuuuuu my one and only superstar rajinikanth sirree	Positive 
 Bgm evanda pottadhu dsp paiyana irupaan pola veenaponavan	Negative 
 ivlo violence kandippa intha padathukku A certificate kodukkanum...intha padatha yaaru thalaila katta poraano thaanu..vaangura distributors ungalukku sangu thaandaa...soothanmaa irunthukunga..	Negative 
 Black sheep kutty moonji vivek fans hite like	Positive 
 Orutharmela irukkura viswasatha kaatta innoruthara yen asingapaduthuringa.... Semma dialogue.... Verithanama waiting panren...	Positive 
 Bigil Left la poh ! Kaappaan Right la poh !	Positive 
 Vendum vendum asuran pola padam vendum ... Enpt vendam	Positive 
 Sema BGM Semaya erukkum padam waitingle veri yeruthe	Positive 
 Othaaaaa poooluu mari iruku Graphics	Positive 
 V for vendetta dialogue  An idea can't be destroyed	Positive 
 #VenkateshDaggubati74 Is Asuran Remake  All The Best Venky Sir	Positive 
 OMG.... Thalaivar vera level..... Love you thalaiva...	Positive 
 Gud thaan..but Elam kolapura mathiri iruku..	Positive 
 Katha than mukkiyam ana trailer semma	Positive 
 Oru raksha illa Mone kaithiii uff	not-Tamil 
 Ivaru tha hero mathavanka LA zero va title yosika therila Ivan kuda action king vera pathu ena nadaka pokutho	Negative 
 Omg Yarellam Thala Ya Pakka Wait Panninga	Mixed_feelings 
 anikunju(vijay) movie oru naal rendu naala theatre la iruthu eduthuruvanuga conform intha movie release aana	unknown_state 
 Tik Tok Thala veriyan selvasaisaran	Positive 
 Thalaivaaaaaa. . . . Ne matum than nadigan ne matum than super star..	Mixed_feelings 
 Rajnikant sir toh din ba din jaban hote ja rehe he yar.....i love you rajni sir	not-Tamil 
 Is movi ka music bahut dasu hh jai asuran	not-Tamil 
 Diwali iku Meet panuvom bro bigil fans	unknown_state 
 Vera Vera Vera level doi mass  music Pakka	Positive 
 Movie Tamil memang best ...terbaik Ajith	Positive 
 1:42 noticed nee yaruda komali channel jainth	unknown_state 
 Video start aguradhuku munnadiye like poten  Happy to see Prakash Raj sir back	Positive 
 Sweet saapda pooram  pongal vera lvl la erukkum	Positive 
 ಅಕ್ಷಯ್ ಕುಮಾರ್ ಅವರು ಭಾರತದ ರಿಯಲ್ ಸೂಪರ್ಸ್ಟಾರ್... ನಾನು ಅವರ ಯೂಮ್ಬ ದೊಡ್ಡ ಅಭಿಮಾನಿ..!	not-Tamil 
 Views got stuck on 70k	Mixed_feelings 
 Trailer marana mass FdFs poravanga therikkavidunga Saadha sk padam naale comedy yaathaan irukkum. Anna ithu different script. Next level Sk	Mixed_feelings 
 Racha rambola tala luv u from hyd	Positive 
 Bony kapoor🤣🤣 jyda paisa h mc to stok market me lga laudaa  typ ki movie h bc	unknown_state 
 Nerkonda Paarvai vs pink who is best?	Mixed_feelings 
 58k dislike pottavan tha kadasi vasanthuku vekka padanum	Positive 
 Ayooo Thala lv u Thala. Sema mass Thala look  Sema. 🥰	Positive 
 I like karthick subburaj......direction...... karthick subburaj gets rocks	Mixed_feelings 
 Sure blockbuster Congrats from thalapathy fans  Lokesh kanagaraj	Mixed_feelings 
 Enga thalaivar eppavumme masss  nu sollravanga mattum hit like pannitu ponga.......	Negative 
 Trialer super maran padam vettiri pera valthukal	Positive 
 Thala indha look la semaya irukkaru 🤩🤩🤩	Positive 
 Rasanai illadha pullingow, apdi enna korai ah kandu pudichitanga indha video lae dislike panra alavukku	Positive 
 Bigil  lavathu mairavathu Karthi in kaithi ya paaru da	unknown_state 
 U1 tharamana sambavam aug 10 apa papinga	Positive 
 Enna da trending laye kaanom ....	Positive 
 Rowdy ingala hero va katti vanmuraiya thundarady vetrimarnukku velaya pochi.Yevlo Enda nattukku thevayana Nalla karuthukala vachi flim edukalamla.	Negative 
 Thalaaa maranaaa masssss love u thalaaaa	Positive 
 Sad to say, but seems like rekka 2....hope I'm wrong!	Mixed_feelings 
 U1 bgm vera level ..thala vera level acting	Positive 
 Scene like remake....from hindi movie PINK ....	Positive 
 A MAGNUM OPUS SHORT FILM   FI SHORT FILM MAKING IN ZERO BUDGET	Negative 
 Intha trailer la neega like rajini kaga pada venna oru tamilan padaippu kaga podunga ...	Mixed_feelings 
 Unlike panradhukkune wait pannittu irundhurukkanunga 13k padunga	Negative 
 Thalaivar style la sollanum na trailer WOW	Positive 
 Oruthan mela visvasatha katrathu kaga innorthara asinga paduthuringa	Positive 
 Enagada YouTube inum trending la add panama irukinga	Mixed_feelings 
 Sema masss Rajini & Vjs combo marana waiting	Negative 
 Objection enna voice paa marubadium pananum pola iruku	Positive 
 Yarellam note paninga teejey movie la vandharunu 🤔🤔🤔🤔	Positive 
 THALA always masss.. Ippo sollava venum U1 music vera level ah irukkum...	Positive 
 En innum trending la varala? Ennada panringa YouTube fellows?	Mixed_feelings 
 Super video and super star mass	Positive 
 Thala look Vera level LA eruku	Positive 
 kaithi Diwali Super Hit Bigil Diwali Blockbuster	unknown_state 
 Trending la namba Thala trailer thaa..num1...	Positive 
 Ranga Raj panday sir action super	Positive 
 Dhanush Anna vera level u look awesome	Positive 
 Bollywood movie Pink remeke   lol	Mixed_feelings 
 Ajith Thalathala nu irukaru nalla gummunu	Positive 
 thalaivaaa...enna ethu epdi chinna payyan mathiri...petta paraak	Positive 
 Entha padathile vikramkku robba dialogue s ellai	Positive 
 Akshay Kumar new trailer Kadak look	Mixed_feelings 
 Amy Jackson ka naam mention nahi kya	Positive 
 Kola kaandla irukken mavana kollama vida maatten.....sama mass dialogue...	Positive 
 Engada nama superstar fans trailer aa 100Million aa akugada please	unknown_state 
 Koor konda parvai  Ajith eppavum first ethilium best	Positive 
 Thalaivar matum tha , petta paraaaaaak	Positive 
 Dislike potavaagaa unaga vijay 63 varapa paarugadaa 300k dislikess	Mixed_feelings 
 Trailer last dialogue to dir ranjith  Oruthar mela vishwasam kaatrathuku inoruthara yen asiga paduthuringa	Positive 
 Release kulla 15 million views varanum bro	Positive 
 Masss trailer.... Antha 26k dislikes pannavangalam yaaru Samy nengalam.. epdithan ungaluku Padam edukanum ithuku mela...	Positive 
 mgr kitta rajini yala umba kuda mudiyathu ha ha	Negative 
 10 Milion views ku waiting	Positive 
 Dei 10 million views dhan pa vandhurukku Vera yaarumae illaya pa	Positive 
 I am weiting thala mass speechnig thala veriyan	Positive 
 Shivakumar be like  thambi Shankar ethu en kadha..... Akshay had done my role	Mixed_feelings 
 Enga Thala epovum mass thaan	Mixed_feelings 
 The lion, thani kaatu raja yanga  thala	Positive 
 Thala fans idhu pathadhu, innum neraya neraya neraya venum!!!	Positive 
 Adiye Meera ni vikram vedhala Madhavan kuda nadichavathana athan un nilama ipdi..	Positive 
 Vetrimaran sir matum tha unaku hit kodupaaruu.. Sariya avara vituraatha	Mixed_feelings 
 Ithula vara ovvoru dialogue un enga dala ya pathu solra mathiri iruku	Positive 
 Evlo girls intha trilar pathutu like potinga.... link share paninga.... like panunga	Positive 
 Karthi (kailii vettii) kattitu naducha Padam hit and blockbuster thann Antha varusaiyil ithuvum ondruuu	Mixed_feelings 
 2020 Thalapthy Vijay   Makkal selvan Vijay sethupathy	unknown_state 
 Thala pole varumaaa  Ore oru thala dhaaaaa  Aaattam inime aarambika pokith machiii  Picture abhi baakki hai bhaayi	Positive 
 voice powerful neraya neraya neraya neraya neraya.	Positive 
 Bigil trailer ah  pathutu vanthavanga evloo per ....?	Positive 
 viswasam enga poga poguthunu theriyalaya. PETTA PARAAK	Positive 
 692 k likes reached aairuku	Positive 
 Nalla irrundha manusana ippadi pannitenga Leh da.... U1 sathiyama wasted this movie..	Negative 
 Padipu avasiyam tha but system serila pa	Positive 
 Unga kooda poi sasikumar ah chee	Negative 
 Eduthu vainga Da ellam award aiyum	Positive 
 Paaaa first' scene look....**  Ithu mathiri Actor nan pakala samy daa ..	unknown_state 
 Ithu ega ariyavila eduthathi epadii.... 🤙🤙🤙	Positive 
 Anna vida thambi nalla kathaila nadikraru	Positive 
 i think ajith just makes a guest role	Positive 
 Music semma Tq u SAM C S.......	Mixed_feelings 
 Viswasam trailer needs 20k likes to reach 1.4m likes	Positive 
 FIRST DAY FIRST SHOW FOR KAITHI MOVIE	Negative 
 Control panna mudiyala..... Waiting la veri yerudhu	Positive 
 love  u  rajni  sir	Positive 
 Trailer ela semmaya dha iruku...aana SK va patha dha super hero feel vara matikudhu	Mixed_feelings 
 i love ajith from andhra pradesh	Positive 
 It's not looks like a Ajit range of movie.	Mixed_feelings 
 663 my view I am Telugu die hard fan of Rajini sir 🤘🤘🤘	Positive 
 iyoo... therikuthu....enna style ah irukaru ya.. thalaivar uhu..	Positive 
 Ye to Pink movie ki tarah lag rahi h	Positive 
 Akshay jiiiiiii really u r khilladiii	not-Tamil 
 Thalapathy 64 Director Lokesh Kanagaraj Like Pannunga Actor Karthi Like Fans	Positive 
 Sri mahalakxmi   tealugu movie  full movie  dibieng	Negative 
 Kola gaandule iruken mavane kollame vidamaten thalaivar vere level	Negative 
 INDvsPak aavathu mudiyavathu.... Waiting 4 10M views	Positive 
 Remake of Ellam avan seyal movie?	Positive 
 Vikram nadichale adu vera level movie tan	Positive 
 Mass Vjs... Veere veere level	Positive 
 Thaliva semma ,,,dialogue vera leavel	Positive 
 I will set ur screens on	Negative 
 Vetri maran dhaush legendry combo.. padipa matum namba Kita irnthu edthukave mudiyathu .. true	Positive 
 vijay sethupathi ah sariya kataleya iam mode out hw many r nt satisfied hit a like.......	Positive 
 THALA always masss.. Ippo sollava venum Y1 music vera level ah irukkum...	Positive 
 Intha 10 star kamicha than trailer Ana orae ala kamichi trailer oduthu trending la yarnu ellarukum theriyum...	Positive 
 Trailer vara levela erku apo thalaphty 64 epdierkum...  bigil and Kaithi marana mass movieya erkapoguthu.....	Mixed_feelings 
 0:48 to 1:00 yuvan  rocks	Positive 
 Yenakkennamoo Dark Knight patha mariyee irukku	Positive 
 orutharmela  neenga visuwasam kaatrathukaka inorthara edhuku asinga paduthuringa	Positive 
 Namaku thavayanatha namba than adichu vankunum	Positive 
 Nangalum un mela kola kandulathan erukom. Odi poidu.	Negative 
 Petta trailer mass, VISWASAM TRAILER MARANA MASS	Positive 
 Nerkonda paarvai mix with Kolaikaaran BGM	Mixed_feelings 
 Sir... Thalaivar name  kooda  ilaya Super Star pattam Irunthuruntha innum Vera Level la Irunthurukkum ...	Negative 
 yarellam marana mass video song ku wait panrenga	unknown_state 
 Thala tucker  Kola Mass	Positive 
 Thala mass chance illa vera level thala veriyan	Positive 
 vijay sethu ...kerala fans like here	unknown_state 
 Vera level...trailer waiting 4r movie....finshing super... kolaaa ganngula irruken sema ...	Positive 
 Vetri kootani nu marupadiyum nirupichirukku....padam asurathanam	Positive 
 Va Nadippin Naygan chiyaan vikram MASS🤗	Positive 
 Ethuvarai ulagil vera entha trailarum en thalaivar movie 2.o trailer pola illa	Positive 
 Ayyoo yennala oru like ku mela poda mudiyalaye..	Mixed_feelings 
 Hahaha last dialogue with malaysian language	Negative 
 GV..pesama nee music laye irupa..athuthan unaku Nalla varuthu..	Positive 
 Asuran trailer no 1 go nice good	Positive 
 are yar ye tkla fir se kese young ho gya	not-Tamil 
 Enga ooru pakkam thaa Shooting Etuthaanga	unknown_state 
 Thalaivaa unakku nigar nee mattum than love you thalaivaa marana waiting 19 th july	Negative 
 best wishes to the team! 'saavaratha iruntha sanda pottu saavanum sir, kaalila vizhundhu saava koodathu'	Positive 
 Athanala than India la superhero illiya enga Ella mugup panni vanthi edukura case	Mixed_feelings 
 Veera maas... Thalaiva Die Hard Fan From Andhra	Negative 
 Thala yoda dialogue delivery ovvonrum sema mass Vera level  Thala you are great	Positive 
 Oruthar mela viswasam kaata(kaasu , thudtu,money) mathavanga mela yean pazhili poduringa ? Correct thala	Negative 
 Response koreva irukku nu nenaikkathingge after movie release vera level le block buster agum	Positive 
 I am STR ßlood .......nkp vera level....thala mass	Positive 
 Ajith morratu veriyans hit like here guys	Positive 
 45k dislike kunji boy fans	Negative 
 Trailer therikudhu.... Thool parakudhu... Coming pongalukku petta paaaraaak.......	Negative 
 VS annan eppothum semma Love from kerala	Positive 
 Trailer hey pakka verithanama iruku padam epudi iruka pothey intha deepavali kaithi deepavali than	Positive 
 OruthaR mela Neenga Visvasam kaatrathukaaga🧐  Inorthara yen neenga asingapaduthringa   Thala	Positive 
 Ajith Fans Dislike Panna Mattum Pongal Ku Varama Poiduvom Ah	Positive 
 Thalaivan yeppavume vera level tha	Positive 
 Thala mass     Eva enna venalum sollatum     Engaluku bayam illa	Positive 
 Sivakarthikeyan Kerala fans hit like	unknown_state 
 Karthik amazing , thalaiver Rajini so young look semma Pongal Marana mass than🤗	Positive 
 Mass semmayya iruggu super star style mass than	Positive 
 Thala in NERKONDAPARVAI padam vetri pera thalaivar rasigargalin sarbaga valthukal	Positive 
 Sema sema Ajith na pakka mass	Positive 
 Jai thalaiva 68 la superb style	Positive 
 Enna da jentelman Padatha thirumbha eaduthu vachirukkinga........	Mixed_feelings 
 Ennangada kgf bgm ha modify pannittingala	Negative 
 Guys Dailyu Atleast 10 times aavathu paarunga please views romba kamiyya irukku	Negative 
 Thalaiwaaaaaaa........... Va va va ipo vaangadaww	Positive 
 Hero movie trailer evolo peru wait pandringa like pannunga	unknown_state 
 petta visvasam pongal get ready fans parrrraaaaakkksampavam sirappu	Positive 
 2.0 Trailer Likes (24 hrs) - Tamil - 369k likes Hindi - 367k likes Telugu - 143k likes  Total - 879k likes	Mixed_feelings 
 Lokesh kanagaraj kaga trailer partha vanga like... Ethukku na thalapathy 64... Waiting...	unknown_state 
 Thala Da Vera Evan Da	Mixed_feelings 
 Thalaivar padam velli villa kaana valthukkal by THALA VERIYAN VENKAT	Positive 
 Dhanush Fans Mattum Like here	Positive 
 ennna ba innam trending la ye varala	Mixed_feelings 
 Viswasam trailer parthutu nera inga varavungala hit likes	unknown_state 
 Pink Remake Than But Paravalla Thala Nala Pakalam	Positive 
 Enna da elarum Vanda. Vandaya kilicha aprom trend aagudhu sun pictures kekadha kadhuku headset ah	Negative 
 Thala: Are you vergin?? Viewers : ahaa naama play boy/girl nu ivarakkum terinchiduchaa	Negative 
 Nkp kaasukudhu viewsa buy Panala idhu nearmaaiya kidaitha views	Positive 
 Q a q q q nhi upload krte ho yaar my rajni boss	Negative 
 Nanum movie paka kola gandu la iruken.	Positive 
 Nangge thala fans da, vijay 63 kuda nangge support panuvum. Tamilan da! Ennore tamilanne kille thaliyude mathum	Positive 
 Sema trailer a Shankar sir film...bgm sema	Positive 
 Innum neraya neraya neraya likes varranum	Positive 
 VERA LEVEL SK ANNA MARANA WAITING ANNA MOVIE KU	Negative 
 Thala  Vera level u1ana bgm bangam da	Positive 
 marana mass full an full vera leval entry.....	Positive 
 Trending no 1 varanum Thala Fans...	Positive 
 Pink movie  .ajith sir version !!!!	Positive 
 Thalaivar oda style mass yella ithu la tha muzhusa pakka porom romba naal appro	Positive 
 Msssss thala  yanga kadaul thala .....	Mixed_feelings 
 Adei  ethukuda intha velai	Negative 
 #ENRUM THALA AJITH, enrum thala thala thala thalathan solaravanga  ellarum oru like podunga	Positive 
 72 k view 76 k like	Mixed_feelings 
 sema vfx, Shankar sir great	Positive 
 Ena da Thala trailer trending num 2 nu kaatuthu.....y yena achu...	Positive 
 Neenga vilayatunathu enkita illa eman Kita super dialogue	Positive 
 neraya neraya neraya neraya neraya neraya	Positive 
 Mark my words tamil cinema ku set agathu oru padam	Negative 
 Vera level... Yaaru ellam marana waiting la irrukkurathu...	Positive 
 Theater Kaliyala  Ranakalam Avapothu   THALAIVER ROCKSSSSSSSSSSSSSSSSSSSSSSSS	Positive 
 Trailer nalla irukke  super thalaiva Rajini young ah irukkar	Negative 
 Viswasam vs petta 🤘 Tharamana sambavam iruku 🤙	Mixed_feelings 
 Petta parak... thalaivaaaaaaaaa we love you	Positive 
 Paaaaa thaaru maaru ... Thala	Positive 
 Veraaa maari acting ah paakka poringa guys	Positive 
 I want u1 luv song pls	Positive 
 Akshay Kumar ku pathila selfie SIVAKUMAR aa potrukalam character perfect a suit aagum.	Negative 
 Rangaraj Pandey rockzzzz🤗 Welcome to Tamil cinema	Positive 
 THALA 60 ku yaru waiting panriga like pannuga	Positive 
 BGM Vera level ..iruku ...u1 ..love u	Positive 
 itna ghatiya hai trailar lag raha hai  ko tv serial dekh rahe hai thu hai aise trailar par	Negative 
 Lets give a like for Nerkonda Paarvai	Positive 
 Arjun real hero super sir salute sir	Mixed_feelings 
 Thala acting king nkp Vera level mass.	Positive 
 Pakkka thala I luv u by surya fan	Positive 
 Ovvoru framum supera iruku vaazhtukkal Shankar sir	Mixed_feelings 
 0.51 Sec Hollywood level la iruku	Negative 
 Dei yennathan negative a sonnalum Thala orutharukaga padam hit aagum aathuku naanga irukom	Positive 
 Kaipulla Vijay Twitter la Trending agudhu	Positive 
 Yarellam Neraya! Neraya! Neraya! Thadava Pakuringa	Positive 
 Thala mass I love you Anna	Positive 
 #Ethuna Peru #enga #Advocates irukiga, #pullaarikuthu #scene lam	Positive 
 Padam vera level la irukkum pola.... Conform 250 crores box office	Positive 
 Apdiyellam nadakadhu...nadaka koodadhu...look at his eyes...wow!!!	Mixed_feelings 
 Ellam ok ana last la dha...	Positive 
 Mass na mass pakka mass petta trailer	Positive 
 Mass thala  Appidi onnum nadakka koodathu   Ho Ho ho  Fantastic	Positive 
 Vijay sukran padathula vantha Maari, thala NKP la.	Mixed_feelings 
 Give one like to rajnikanth fans	Positive 
 Real Time 5million + views.. Petta Paraak	Positive 
 Thalaivar is only one super one thalaivaaaaa...	Positive 
 Thala AJITH KUMAR Sir Nerkondapaarvai... Marana waiting Da..	Positive 
 Thalada Thalaya Minja Tamil Naatla Veara Ewanda 🤔???????	Positive 
 664 k likes vanthuru marana massss thalaiver verithanam	Positive 
 Moratu mass karthi . Sam done good.	Positive 
 खान तो बहुत थे पर खिलाड़ी बस एक है। the one and only mr. Akshay kumar	not-Tamil 
 trailer BGM vera level asuran vettai arambam	Positive 
 2.o- tamil cinema milestone if u agree like	Positive 
 Asuran trailer 2M good good	Positive 
 @Bigil trailer vantha  Entha padamum diwaliki varlanu solliduvaanga paakringala.... Only for Thalapathy......	Mixed_feelings 
 Intha pundaiku than built up da	Negative 
 Marana mass Thrilling haa irruku pola SK Anna I love u naa	Mixed_feelings 
 Believe me rajni sir ki baat hi kuch aur hai	not-Tamil 
 THALA Fan FROM   Belgium	Positive 
 I Hope Hero Not  Become Mugamoodi 2	Mixed_feelings 
 Dai ena Padam Da eduthu vaichurukenga??? Tha Sama Da ...	Mixed_feelings 
 SUPER STAR only rajani sir SEMA mass🤗🤗	Positive 
 first flope of sjankar sir..flope movie..	Negative 
 Why likes go slow thala bloods.... 1M likes varuma	Positive 
 780k likes on d way	Positive 
 Peta nu peta ani anochuga.petta ani Petta kodila aravala? Tamil over ennenlu Ayina podu .sambar saambaare🤣🤣🤣🤣🤣🤣	unknown_state 
 Release in Telugu karthi Anna	unknown_state 
 Manju mam super performance love you	Positive 
 Monkeys Like here  Donkeys Comment	Negative 
 6 days after coming fans 6:01    PM	Positive 
 kevala ma erku padam flop than	Positive 
 But thala gethu energy  epovu korayala	Positive 
 உத்யநதி ஸ்டாலின் ..red giant movies sun tv sun tv......corporate crimina	Negative 
 keka.. love from telugu rajini fans	Positive 
 Enga ore star thalaivar super star rajinikanth massss Vera leaval thalaiva mass pakka massssss	Positive 
 Vikaram sir+ bgm pullu arikkithu.marana mass waiting	Positive 
 Thalaivar dhanush anna	Positive 
 Dislike pannavagala paathi pearu vijai blood poaaala	Negative 
 Sema Anna sema Anna sema Anna	Mixed_feelings 
 Simbhu rasikan yethana per paka vanthurikingha potra like ah	Positive 
 What a trailer, indian cinema va vera level ku kondupoga poguthu intha film Akshay kumar vera level Superstar	Negative 
 Oruthar mela viswasam katradhukaga innoruthara asinga paduthurom	Mixed_feelings 
 Namakku thevai aanantha namma thaan adichu pudunga um	Positive 
 2:06 vig kaiyoda vandhudumonu bayandhuten	Negative 
 dhanush anna kola maas   edukangada award a enga thalaiku	Positive 
 VIJAY ANNA FROM KARNATAKA  KICCHA SUDEEPA ANNA DIE HARD FANS ENERGETIC TRAILER	Positive 
 Addda dda yena trailer paa idhu	Positive 
 thirunelveli thala veriyarkal oru like podunga	Positive 
 ajith Sir neenga Vera level sir	Positive 
 yov poya ethanai Thadava than paakurathu ... Vera vela seiya vida maaturaru intha Aalu	Negative 
 Padam blockbuster aakumnu nenakiruvanga like pottu ponga	unknown_state 
 ada paveegala eppadi iruntha manusana ippadi akiteengalada	Positive 
 Superb look rajini sir and very stylish	Positive 
 Yaarelam Vijay Sethupathikaga trailer paaka vanthinga Hit Like	unknown_state 
 Ayoo..... Thala waiting la ya veri avuthu	Positive 
 2.08 to 2.10 gun rotating style semma super	Positive 
 Romba nal aparam oru sirapana trailer	Positive 
 1:55 sema thala super ah sonninga	Positive 
 Rip  Krish ... Thor .. Iron man  Sakthimaan ... Badman ....	Mixed_feelings 
 Indha maadhri padam paathu yevlo varusham aagudhu	Positive 
 Trailer naa ipti irukanu kappan nu oru trailer vittangale oru feel ye kedaikala athula irunthu... Chai	Negative 
 326K likes in 1 HOUR	Positive 
 Diwali ye inaku vantha maathiri iruku	Positive 
 Petta blockbuster avum nu solraavnga like podunga	unknown_state 
 Ipo trending no 1 la entha trailer iruku	Positive 
 Rajini ah Romba ilamai ya  katna Karthik subburaj ku oru	Positive 
 Konjam mathungada otha ....like-commentunu...enda unakae theriyadha like dhan varum.Gotha	Negative 
 Thala padam karuththu athigama tha irukkum	Positive 
 Thalaaaaaaaaaaa I'm waiting for big screen marana waiting	Positive 
 Thalaivaaaaaa nenga nadichute irukanum ipdi Mass ah....  Atha nanga paathu rasichute irukanum thalasivaaaa....  Love you thalaivaaaa	Positive 
 End ley dialogue purinjitha appo sandaiya neeruthunga da pakkigala	Positive 
 Amy Jackson fans kill like button	Negative 
 Adhaan narachu pocheyyy aprm enna naraya naraya naraya nu kathura.	Negative 
 Kajal  Fans Subscribe	Positive 
 engalukku arasiyal rajini dhan pidikkadhu...acting la semmaa...Thalaivaa	Positive 
 Ejjaathy padam   villain voice anyaaayam	Positive 
 OMG kola masssssss thalaiva aaaaaa super	Positive 
 ena patamo ethala poiyarunga paappa . ajith fans mattuntha poi pakkanum.	Positive 
 Dislike pannavan Ellamea raththam kakki saavaan...	Negative 
 ONE MAN ARMY THALIVER MASS LEVEL	Positive 
 Super Vijay Sethupathi  from a Telugu fan, Makkal selvan Da 🤘🤘	Positive 
 Enna nadipu ennaa manushan yaa.. thala na thalaa taan	Positive 
 Bgm is like kaala poraduvom song	Positive 
 shabaaa ena style ma gun suthuradhu yabba sami inoruthan porandhukuda vara mudiadhu thalaivaa	Negative 
 BGM Ku oru like poduga	Positive 
 Unmai aana Thala fana irundha like pannunga	Positive 
 BulShit akshay tum say tu yeh umeed nahi the	Negative 
