text	category
 Yarellam  #bigil promo pathutu varenga  Hits like	unknown_state 
 Yenga Viswasam 135k Comments  Unga Petta Verum 34k than	unknown_state 
 Vera level thala ne va thala	Positive 
 Super super super super super super...........	Positive 
 Last tamil subtitle yaaru rewind panni padichinga like podunga	Negative 
 pongal rece la yaru win pannuva? like petta comment viswasam	Positive 
 Looks very good....vaa thalaiva vaa !	Mixed_feelings 
 Intha trailer kku wait pannuna  Vijay fans Oru like pannuga	Positive 
 1:55 aduthan ella pakkamum thuppaki irukku la appram edukku sutti sutti sudureenga	Negative 
 vera leval thala I like super	Positive 
 Rajini kanth fans like , subscribe and share	Positive 
 Makkal SELVAN ,na suma va    Mass	Positive 
 Comment section leh anils vaire erenji katererange 🤣🤣🤣🤣! Poi vere edetele umbe*ge! Iteh thala koteh! Enge trailer	Negative 
 Dislike podurave avanga amma ellam SILUKU da.	Positive 
 2.5k dislike ah.... Mentally challenged konjam per iruppanka pola	Positive 
 Enna panna poram... Sweet sapda porom	Positive 
 Diwali ku Tharamana rivalry irukku ...naa thalapathy fan but trailer semma worth...kola mass...	Positive 
 Trailer la marana kaatu kattitangah  Get Rajinified  By THALAPATHY FAN	Positive 
 “Orutharu mela ninga viswasam katradhukaga innorathuru yen asinga paduthiringa” mass thala ninga	Positive 
 What an amazing star casting,  super starukkitte modhappovurathu  sariyana aambalakkoottam....	Positive 
 Neraya neraya neraya wait seiram thala	Positive 
 GV Prakash + Dhanush + Vetrimaaran = Better Quality	Positive 
 dei youtube mairu 1cr views trending la vai daa	Negative 
 Ipdi neraya neraya neraya neraya neraya....	Positive 
 A r rahman fans hit like here	Positive 
 Dai  potai vetri maran unaku  night  thavira pagala  edakathriyadha	Negative 
 2.O, ULTRA BLOCKBUSTER, LIKE IF U AGREE, 🤘🤘🤙	Positive 
 Konjam porunga Vishwasam trailor varatum appo therium yaaru gethu nu	Mixed_feelings 
 0:30 jesse pinkman maari irkundravan mattum like podu	unknown_state 
 Daii pink padathula fighta varathu AJITH DOES NOT SUIT AMITA BACHAAN	Mixed_feelings 
 Deepavali nov6 but engalukku nov29 dha deepawali	Positive 
 enna style, enna speed masss thalaiva....	Positive 
 Ullalaa and marana masss video song release pannunga please 🤗🤩	unknown_state 
 super star na aathu thalaiver mattum tha vera evanu kidaiyathu petta pongal petta parak	Positive 
 ONE WORD : MASTERPIECE  THANKYOU SHANKAR SIR FOR VFX TREAT	Positive 
 Ena story nu guess panna mudiyala	unknown_state 
 Dislike pandravanga elam rajini sir ah parthu poramai pidichavanga....	Mixed_feelings 
 Thaliva semma ,,,dialogue vera leavel	Positive 
 Marana mass ,Chiyan Vikram gr8 acting	Positive 
 Nalla thanda irutha eduku da intha sambavam	Negative 
 Namba kitta Kaddu iruntha eduthukuvanunga rubba iruntha pudingikuvanunga ana padipa mattum pudnga mudiyathu  Dhanush dialogue delivery	Positive 
 Vijai seathupathi kaaga naa padam paaka povaa!!!!!!	Positive 
 Thala fans alrumkum nar konda parvi number 1 tniring varnm	Positive 
 Rajesh m.selva engada ennoda thalaivan name  Vikram	Negative 
 To Haters: Ungalukku comfortable ah illana neenga kanna moodikkalaam..	Positive 
 Daii H. Vinoth nee enga da iruka aiyoo dheivam da nee	Positive 
 Ethuku siva ku intha vela nu nenachen ana trailer super ah iruku	Mixed_feelings 
 Thala powerful performance neraya neraya neraya neraya.	Positive 
 Podu podu podu .......vathalai va vaa vaa vaaa	Positive 
 That Climax Dialogue...Padippa MḀṮṮṳM Namma Kitta eduthukka mudiyadhu	Positive 
 Vikram sir u looks absoulet great	Positive 
 kaidhi deepali ku semma treat irku	Positive 
 Thala ajith nerkonda paarvai awesome verra level	Positive 
 Like pottutu trailer pathavange .... Hit like comment	Positive 
 AjiTh FanS Ku AjiTh(A) #RajiniFan irunthu solrapula LasT Dialouge...	Positive 
 Kali jattiyode janury 10ku  odapora ,	Negative 
 thannam pikkayin sikaram eppothum enga thala thaan	Positive 
 Ajith Sir semma  By thalapathy makkal iyakam  Rasipuram	Positive 
 Inthe movie pink movie veta record pannumnu solravanga like po2ga ak fans comment pannuga	Mixed_feelings 
 Like pottutu thaan trailer paathen.. Semma mass trailer	Mixed_feelings 
 Dei ipo ithu ena pana trending no 1 varum....	Positive 
 Ena da trailer evolo nala ah iruku	Negative 
 FDFS poga poravanga ellam like podunga	Positive 
 Seems like it’s gonna cross Pink.	Positive 
 Teaser pakradhuku munnadi cmnt pannavanga like podunga	unknown_state 
 ULTIMATE SUPER STAR THALA AJITH KUMAR	Positive 
 Dislike podradhuke YouTube pakam vandha thalapthy fans like aa podu	Positive 
 Sk on fire.... SK fans like bere	Positive 
 Trailer pudichivange like pannugu..  #Thala	Positive 
 Who is best movie Diwali? Bigil movie LIKE   Kaithi movie. COMMENT	unknown_state 
 Marana Massssss..... Love you Thalaiva.	Positive 
 10 timekku mela pathavangka like pannungka	Negative 
 Again and again........    Watching......	Positive 
 Poggaloooooo....Pongal... Petta Pongal...... Petta parak .parak .parak	Positive 
 Thala I love you Thala Semmaiya iruku    trailer	Positive 
 Ellam seri thaan... Aana antha last shot la back dive ah nenacha thaan lesaa nenju valikara maari iruku	Positive 
 thala thala than mass marana mass	Positive 
 Trending #2 Ku vandhaodana trailer pakaravanga like podunga	Positive 
 Ellam ok but kadaisila antha fight scene vachiruka koodathu	Mixed_feelings 
 Paka thana pora intha kali oda  atatha	Positive 
 Paaka smart Aana hero ila but tallent irunthaa poathum jeiklaamnundrathuku example dhanush tha	Positive 
 BALAGI SAKTHIVEL SIR SARIYA PORUNTHIRUKARYAA POLICE KARARA	Positive 
 Kaapan movie ha idhu clash Pani irundha kilinchu irukum asith pundai 🤣🤣🤣🤣🤣🤣🤣🤣🤣	Positive 
 Thala bgm Vera level U1 I love u	Positive 
 Padam parthutu trailer pakuravanga  like pannunga friend's	Positive 
 2020 Diwali valimai thala Diwali 🥁🥁	Positive 
 Double Agent,  C Vik &  ലെന	Positive 
 Comment la ellam kudutha kaasuku mela sombu thookuranga	Positive 
 Thala dialouge delivery + Yuvan Bgm vera level	Positive 
 Back to paruthiveeran karthi..making la  kaithi best...	Positive 
 Vijay sethupathi sir Iam big fan telangana plz release in telugu	unknown_state 
 Tamilaa's ippo podapora like le ulagame thirimbi paakanum da thalaivar all time mass nu theriyanum.	Positive 
 Camne bole trending kt malaysia? Yg dri malaysia like	unknown_state 
 Onakku ithellam set agala.. Thambi siva..	Positive 
 Chenna pasangala ormma poi vilyaduka  world mass opening coming	Mixed_feelings 
 0:47 goosebumps bgm thala + yuvan	Positive 
 Thalaaaaaaaaaaaaaa aaaaaaaaaaaaaaaaaaaaaaaaaaaaaaaaaaaaaaasaaaa aaaaaaaaaaaaaaaaaaaaaaaaaaaaaaaaaaaaaaasaaaa aaaaaaaaaaaaaaaaaaaaaaaaaaaaaaaaaaaaaaasaaaa aaaaaaaaaaaaaaaaaaaaaaaaaaaaaaaaaaaaaaasaaaa aaaaaaaaaaaaaaaaaaaaaaaaaaaaaaaaaaaaaaasaaaa aaaaaaaaaaaaaaaaaaaaaaaaaaaaaaaaaaaaaaasaaaa aaaaaaaaaaaaaaaaaaaaaaaaaaaaaaaaaaaaaaasaaaa aaaaaaaaaaaaaaaaaaaaaaaaaaaaaaaaaaaaaaasaaaa aaaaaaaaaaaaaaaaaaaaaaaaaaaaaaaaaaaaaaasaaaa aaaaaaaaaaaaaaaaaaaaaaaaaaaaaaaaaaaaaaasaaaa aaaaaaaaaaaaaaaaaaaaaaaaaaaaaaaaaaaaaaasaaaa	Positive 
 Pakka Mass irukkaru Thalaivar  Poglalukku Confirm Thalaivar treat tha	Positive 
 Iyoooooo marana w8inggg thalaivaaaaaaaaaaaa,,,  indha alavu oru padathuku w8 pannadhu illaaa thalaivaaa,,, ommala yennaiku orae superstarrrr dhan da	Positive 
 Dei dislikers vayiru erinji saavunga da	Positive 
 Trailer kola mass padam meratti utturum	Positive 
 I want yuganiki Okkadu part 2	unknown_state 
 Samaa superrr thala machans oru like podungha	Positive 
 Pakka mass trailer thalaivAaaaaaaa......pinnitinga ponga.....alluthu......proud of u thalaivaaaa........	Positive 
 Awesome but Prakash Raj is not perfect, jaga pathi Babu is best	Negative 
 Trailer na  ipdi irukanum!!! Maasssssss	Positive 
 Tamil Movie Hollywood Range , pearumaya irukku	Positive 
 Thala fight vera level Thala veriyan	Positive 
 Dislike potadhu bigilu fans than pola.....nalla irundha appreciate pannungada...yen ipdi saavureenga🤣🤣	Positive 
 U kena tunggu lebih lama lagi Untuk tahu sayawow	not-Tamil 
 1:21 Manju chechi  #romanjam .. reminds a lot of bhanu from kanmadam	Positive 
 Viswasam reach aitunu petta kevalamaa pesathingu.....thala solrar pola	Positive 
 Padu mokka..ithuku cartoon network la swat cats pathutu poirlaam	Negative 
 Ellam avan seyal padam maadhiriye irke   #Vandumurugan	Negative 
 SAM CS BGM  DOP-SATHYAN SOORIYAN ANBARIV STUNTS PHILOMIN RAJ EDITING LOKESH KANAGARAJ DIRECTION  KAITHI BLOCKBUSTER	Negative 
 pangaaligala intha vegam paththaathu innum vegama views ah ethunga	Positive 
 Yar yar mrng THALA pakka vandhinga  Love u thala Repeated mood	Positive 
 Trailer sama mass sa iruku	Positive 
 Neraya neraya neraya neraya neraya ...mokka pootutu irukeenga	Negative 
 Script ku Enna Thevayo adha  endha korayum illa Pandrathula King Dhanush	Positive 
 Veraaaa level ajith sir vinoth Anna ending semaaaaaaaa no words to say	Positive 
 Trailer lam nalla irukku...!! Aana padatha release panna maatringale pa.....	Positive 
 Goosebumps wow thalaivar Marana mass petta parak	Positive 
 Manju Chechi  lady super	Positive 
 thala neenga dhaan hero va	Positive 
 I am ViJaY fan but Vera Vera level	Positive 
 August 8 aamaiyans aluga poranga  🤣	Negative 
 Last dialogue enamo yaraiyo intimate pandra Mari iruke  Any guess??	Mixed_feelings 
 One more flop for Shankar	Negative 
 Cmnt section pona like here like here nu uyira vanguvanungalehh🤔🤥	Positive 
 Ghibran ku aaagavey padam hit aaganum	Positive 
 Ufff semmayo semmaa .. ennna superuuuuuuuuuuuuuuuuuuuuuuuuuuuuuuuuuuuuuuuuuuuuuuuuuu	Positive 
 Last dilogue : pollachi incident..thala	Positive 
 MADAN GOWRI paatutu trailer pakkuravanga unga thumba use pannunga	unknown_state 
 Yuvan Shankar Raja musical mass the BGM king of YuvAN Shankar Raja	Positive 
 KOLAMASS TRAILER  WAITING FOR THE EXTRA ORDINARY PERFORMANCE OF DHANUSH & MANJU WARRIER	Positive 
 Sirappana tharanamaana sambavatha idhukkapparam thaaa paakka pora	Positive 
 10 time mela patam pathitu trailer pathavanga like panuga.	Positive 
 Neriya neriya neriya neriya neriya neriya neriya neriya neriya neriya neriya neriya neriya neriya neriya neriya neriya	Positive 
 Teaser la irundhadha apdiye trailer la potrukinga...avlo lam nalla ila.. So sad	Negative 
 i big fan of u ajith sir	Positive 
 Only 2 days ta pa enjoy panurum panurum	Positive 
 எம்ஜிஆர் பெயர் batch la iruku Yarellam pathinga	unknown_state 
 Waiting for sirapana tharamana sambavam.... ... Super star........	Positive 
 Thala Fans from kerala.. Like here	Positive 
 Movie tittle mass but padatha ethukku telungan produce panni telungan nadikkurannu teriyalaye	Mixed_feelings 
 Unnathamana  characterukku arumaiyaka thannnudaiya unarchikalai velipaduthiya engal mr. ajith sirkku mikka nandri	Positive 
 All the best Sir from karantaka Fans Yash Boss Fans Karantaka	Positive 
 Trending No : 1 .13/12/2019. 6:44 PM	Positive 
 Petta Parak Thalaivar Pongal. Sirappana Sambavam...	Positive 
 En thalaya Kaevalama pesuna Ella ippa Thirruppi paakkarunga	Positive 
 What a man Rocking Vikram sir	Positive 
 Kola gaandla iruken.....kollama Vida Maten...... Vintage thalaiva back.......	Positive 
 Maranam mass u maranam adukku thalaivartha poranthu varanum🤩🤩	Positive 
 Thaa thala naa thala thaaa ayaaa	Positive 
 Yaarukellam trailor pidichi irukko avanga like pannunga	Mixed_feelings 
 Enna da 4 naal kazhichi trending la varuthu evlo da selavu panninga	Mixed_feelings 
 Ipdi muttathanama padam edunga. . Urula naainga vettitu savuthunga	Positive 
 Kadu iruntha eduthukuvanunga... Kasu iruntha pudigikiduvanunga ... Padipai mattum eduthukave mudiyathu.... sema dialogue...itha  Feel pantravanga like panunga	Positive 
 Ethirpartha aluvuku illa trailer apurum Vijay Sethupathi ku kaga pakalam super star mass illa intha padathulaa koncham kamipanitingaa	Positive 
 Kaithi semmayarukum pola asuran appa bayangaram  bigil jolyarukkum	Positive 
 01:09 Padippu mattum namma kittayirunthu eduthukidave mudiyathu chithambaram	Positive 
 Mokka Pandey in movie too.. velangidum	Positive 
 Petta - Marana Mass Official Video (Tamil) | Rajinikanth ... - YouTube	Positive 
 Ayyyyyyyyyyyoooo... Marana level... Kalaila irundhu ethana dhada paathennu enakke therila.... Paathute irukken....	Positive 
 Want nevetha pethuraj hot song 1	unknown_state 
 Daily 10 times ku intha trailer pakuran.	Positive 
 Last la dance aadumbodhu paridhabangal gopi madhiri ye irukku	unknown_state 
 Thala oru vazhiya nalla script.. ini jayamae!!!!	Positive 
 OK but expectationa complete pannala. rajni vjs semma.	Positive 
 695 k likes reached aairuku  pangalingala adichi thookalamaa	Positive 
 Misnarry kaikuli vijay padatai indukal vachi saivom	Negative 
 Yuvan Shankar Raja Musical name ah full screen la podunga pa movie la. Fans kudukura applause ah appo paarpinga	Positive 
 g.v prakash music ku i am like	Positive 
 Intha trailera NEREYA NEREYA NEREYA NEREYA NEREYA thadavai pathavanga like pannunga	Positive 
 Rajinikanth fans like here  I expect 1k likes	Positive 
 Thala kola mass  Vera level Thala Ak	Positive 
 If you are bad then...... I am ur dad	Positive 
 Thala yuvan compo........ Sollava venum pangam pannitinga...........	Positive 
 Yenda Sam c s unaku vera music eh varadha??	Positive 
 Thala mass pakkka masssss thala da	Positive 
 Thala fans apde like ah potu pongapa	Positive 
 Fdfs porathuku munadi litae ah veri ethikirom thalivaaa	unknown_state 
 Ethir pathatha vida Pala madangu semmaya iruku periya sambavam iruku dec20 thailaivaaaaaa sk	Mixed_feelings 
 Vera leval sk anna love u	Positive 
 ethu va eppadi na.apo thalapathy 64	Mixed_feelings 
 750 like wow wow so like	Positive 
 Enga Viswasam Thala Ku Mattum Dhan . Neraya Neraya Neraya Neraya record ah enga Thala oda Trailer Padaikum	Positive 
 Ajith fans lam like ah norukungo.....	Positive 
 Thalaivar enaikumeee masss tha pa meaning of style	Positive 
 Trailer Semma ,  Trailer pakka vantha Thalapathy fans mattum like pottu du ponga	Negative 
 Adadaaaa daaaaa.... Superrrrrr... Marana mass... Plz ரஞ்சித் direction enimel venam	Mixed_feelings 
 Padam ippavey pakanum pola yarukula eruku?	Mixed_feelings 
 Padam mattum release aaguttum  Naraya Naraya Naraya Naraya thadava naa theatre la poi En thalaiya paapen	Positive 
 Bhai kaun makeup karta h Rajni sir ka ......	not-Tamil 
 Ena manushanyaaa pppaaaaaahhhhh inoruthen poranthu varanum	Positive 
 naan intha trailer ah 500 thadavaiku mela pathuddu Aanaa naan thala rasigan daa	Positive 
 Thalaivaa nee va thalaivaa  Naaange eruko	Positive 
 Thalaivaa verra level marana mass trailer	Mixed_feelings 
 Ithu la oru padam ithukku oru traileru	Positive 
 Deii Peasmmma Iruka bigil ku tickets illana pakalam illana tamil rocker thaa	Mixed_feelings 
 Dear haters Ungaluku trailer pudikalana parkadheenga Ungala Yarum inga vara soli varpuruthula Dhayavu senchi aduthavan santhosathula mannalli padadheengada	Positive 
 Petta Trailer (24 Hrs) - Views - 10.2 million views Likes - 546k likes	unknown_state 
 Thala thala thala thala thala thala thala	Positive 
 Thala.. Luv u all time..	Positive 
 pink movie ka  coppy  lagta he	Positive 
 Darbar trailer varavaraikum endha  trailer pathu veriyethuvoom....	Positive 
 Bigil Close .... Happy Diwali With Kaidhii ...	unknown_state 
 Thala U1  Vera Level 🤘	Positive 
 Getha nanthu varaa gate a yellam kadanthu varaaaa......tha podra vediya..........tharamana sambavam	Positive 
 Aisa lag raha hai jaise langoor k hath mei angoor (rashi khanna) de diya ho	not-Tamil 
 6:00+ hour 5Million Views 400k like serapana tharamana sambavangala innemae than pakaporom	Positive 
 Vera level chiyyan  vikram	Positive 
 I am waiting waiting waiting nerkondaparavai thala movie ultimate trailor	Positive 
 Padam Kandippa super hit Agum	Positive 
 Ennada 11 maninu sollitu 10 raikae vittuteengaa	Mixed_feelings 
 Thaalaiva no one can redefine ur mass	Positive 
 soori comedy sema adichika aaley illa	Positive 
 20th exam  mudiyudhu jollya polam	Positive 
 Omg...  Aaaaaaaaaaaaaaaaaaaaaaaaaaa bap re bap blockbuster	Positive 
 Mass  vjs & super cinemaphotograpy	Positive 
 Oru reality kedaikala VFX not good	Negative 
 Padippa mattum nammakitta irunthu eduthukave mudiyaathu.. wow.....	Positive 
 Naanga padam pakkavey varamattom idhula unaa pakka vera varunuma poma	unknown_state 
 Anil thevuduiya pullainga evana irundha comment la en poola oomba vangada	Negative 
 Paaka thaane pora. Intha kaali oda aatatha	Positive 
 Vayasanalum UN style um azhagum innum unna vittu pogala	Positive 
 I'm waiting karthi fans hit like	Negative 
 Thala thala thala thala thala thala thala thala thala thala thala thala ......	Mixed_feelings 
 Indha Pongal Aamai underwear’ode odardhu paaapom! 🥰🥰	Positive 
 See clear last seen vasikaran is Akshay kumar	Positive 
 Ammi Ji ka 'Pink' ka remake	Positive 
 Indha dislike pannavanga yaaru nu ellarkkum theriyum..  Funny guys ever...	Positive 
 Dei Therikke Arjun Fans Hit Like	Positive 
 Maranam massu Maranam toughu tharanum.. Adhukku Avan dhaan porandhu varanum	Positive 
 Inada intha deepavali mokaya poidumonu nenaichen paravala  oru nalla padam varuthuda	Positive 
 Kolai konda parvai    thala thaladan	Negative 
 Adei sun picture ivlo nal trending ilama sudden uh 2ku vandrcha	Positive 
 10+ times pathavangalam like podu	Negative 
 Goosebumps vantha vangala la like podungo	Positive 
 neraya neraya neraya neraya neraya neraya .	Positive 
 Does Vetrimaran not know anything apart from arivaal, kaththi, velkambu, raththam, pagai, kolai etc..	Mixed_feelings 
 Omg sooo smart... gethu thalaaaa marana masssss	Positive 
 Pongalukku paraak .....the 90`s Rajini Back........sirappana tharamaana sambavangala pongalukku paappa......	Positive 
 Final dialogue. ....namma ellarkume dha. .......dread lovr5	Positive 
 Ennada Rekka Second part eduthu vachirkenka ....	Negative 
 Innaiki kulla 800k likes varanum	Positive 
 Vijay sethupathi sir neenga enkita pesnatha enala marakave mudiyaathu.... Labam shooting la	unknown_state 
 god munnadi namma yeappdi equal vo are maari thaan actors la all are equal	Positive 
 Arjun tha hero va movie super ah irukum	Positive 
 Pink Trailer 69K likes Ner Konda parvai Trailer 560K likes	Positive 
 Ithukey tension aana epdi, nee paka vendiyathu inum neriya iruku chellam	Positive 
 paka thana pora intha kali oda attahatha... thalivaaa	Positive 
 Not in hindi.... Sobi don't understand.... But it is outstanding	Mixed_feelings 
 Apne rajnikanth ka power batao or is trailer ko like karo	not-Tamil 
 I am Vijay fans but kaithi supmovie	Mixed_feelings 
 Entha nai da Thalaivarku vayasaaiduchu nu sonnathu Singam da	Negative 
 Adu Maathri Nadaka Koodthu Thala best	Positive 
 Bigil veda kaithi tha semma movie	Positive 
 Oruthr mela viswasam katrathukaga inoruthara en asinga paduthuringa (dislikes)	Mixed_feelings 
 Rajni Sir Rajni Sir Thalaiva	unknown_state 
 Music Harris irutha semma ya irukum	Positive 
 Pink movie ka south remake	Positive 
 “You kene tunggu lebih lama lagi untuk tahu saya”	not-Tamil 
 Thalaivaa  Trending 1st in Singapore!!	Positive 
 Trending 1 vara varaikum vidama paruga	Positive 
 Jathee vari pudicha thavdiya pasingaluku intha badem oru sarpanem	Positive 
 Veri thanamaana kola kaandla irukkaru, visvasam ma irundha visvasam odum illana ___	Positive 
 Trailer vera level!!!Kandippa Viswasam vida Petta BLOCKBUSTER hit agum...	Mixed_feelings 
 thalaivaaa vera level!!!! masssu maranam and vjs	Positive 
 Vada vada trending konduvada  Thala ultimate star before and after	Positive 
 Fghjk dfhjkodd xgklfscjoscj fhkllfss MIND BLOWING	Positive 
 Evan da unlike pottadu inda trailer ku	Positive 
 indha vayasula eppadi Padam nadikkanumnu amitab bachan sirkitta kathukkonga Rajni sir	Positive 
 Iam from odisha   I am big fan of vikram sir	Positive 
 U kena tunggu lama lagi, untuk tahu saya. The right Malaysian Indian slang of Malay.	Positive 
 Vera level dhanush anna masssss.... Dialogue la semma naaa....	Positive 
 Trailer eh ivlo mass uh na...!! Padathula ennalam thala pannirupaaro	Positive 
 Naraiya naraiya naraiya tym pakravanga yaravadhu	Positive 
 Ennada trailer vera level la irukku	Positive 
 Petta block boster movie in telugu Telugu fans like	Positive 
 Ellarum oru tharava joora kai thattunga.	Positive 
 Rajni fansku maraka mudiyatha padama irukum polaye .pongal annaiki diwalidooooi.trailer makes goosebumps	Negative 
 Except for violence, vijay tv serial mathiri iruku	Negative 
 Semma fulla Rajinism than .....  Semma super	Positive 
 BEST WISHES FROM THALAPATHY FANS	Positive 
 Happada Oru vazhiya Siva and team thalaiya vitu poitanga	Positive 
 Verithanam OVERLOAD!!!!! Thalaivaaaaa!!!! ONE AND ONLY GOD OF INDIAN CINEMA!!	Positive 
 G v prakash fans hit like	Positive 
 Dei yeppudi paththalum ithu PINK remake dhane	Positive 
 Yuvan bgm mass thala Vera leval	Positive 
 Ennangada dai views 39kb like 43kb	unknown_state 
 ANY VADIVELU VERIYAN LIKE KAITHI VADIVELU VERSION  -	Negative 
 kya bat kya bat mst trailer	not-Tamil 
 Andha 19 k unlike panavangaluku kolandha porakathu	Negative 
 tat verithanam... inum neraiya.. neraiya.. neraya neraya nerayaaaaa	Positive 
 #THALA Marana Maasss... #YUVAN Bgm Therikkuthu...  #VINOTH Vera level....	Positive 
 Mokaya erukya.. Teaser ey nala erunthuchu	Negative 
 Pongalukku sweet sapda porom but thookudurai ku dah first sweet adhuku aprom dah Thalaivar	Positive 
 Idha paathu chinna pasanga lam maadi la irundhu kudhichu saavanum! Adhane unga aasa	Mixed_feelings 
 Sirapana tharamana sambavangala inimel tha paaka pore	Positive 
 ennanga da 11 manikku viduren nu sollitu 10.30 ku vitteenga. ...irunthaalum vera level.. verithanam.. superstar fans like here	Positive 
 Like only vetri maaran... waiting	Positive 
 Rajini sir Vera Vera level...	Positive 
 Congratz greatest writter poomani sir.................vekkai naaval is wonderfull ...............karisal kaatu ilavarasan....	Positive 
 Indian tamil film next level poga podhu	Mixed_feelings 
 Kalakodumai da kelavaa entha movie um odala tha sethada nee	Negative 
 Petta movie ku romba romba wait panuravanga like poddu gga	Positive 
 Thala vera lvl thala... Luv u thalaaaaaaaaaaa	Positive 
 Woooooooww New Thalaaa semmmmma maas 🤗	Positive 
 Thala ya screen la pakka marana waiting	Positive 
 Any idea about 8.8k dislikers? 🤔🤔	unknown_state 
 last shot apdiye moratu kaala paatha feeling	Positive 
 Intha trailer ah megha akash kaaaga tha paathe...like podreen.....ulaga alazhii	Positive 
 Kola gandula Iruka mavane kollama Vida Mata ..... Masssss thalaivaaaaa........	Positive 
 Petta fans like  Viswasam fans Comment	Mixed_feelings 
 Naan thalaiya ippdi pathadhe illa padam block buster	Positive 
 81k views 89k likes YouTube be like WTF	Mixed_feelings 
 Vijay sethupathye kanan vannavar ivde like adii	Positive 
 Veri thanma ungala pakka evalo per parunga ajith annan	Positive 
 Intha trailer pathapo yarkellam kaththi trailer njyavagathuk vanthidch	unknown_state 
 mass mass marana masssir neenga vera leave	Positive 
 Thala fans and bgm king fans hit like	Positive 
 BGM somewhat gives a feeling like Dunkirk BGM in some places	Positive 
 ennada 3naalku aprm trending..... enna pithalaatamaa iruku......	Positive 
 Nalatha iruku... Aana dhool movie koncham varuthu... Parpomm	Mixed_feelings 
 Elam mariduchi Sam.c.s oda thara  ra thara ra matum marala  but nalaruku	unknown_state 
 August vettai coming soon. Thalaiyoda athirady appatheriyum. Apparam copy ya remake ethu jeikum pakalam	Positive 
 Siddiqui and Rajni sir + sambalpuri music...superhit	Positive 
 ROCKING STAR YASH fans hit like here	Positive 
 Niraya Niraya Niraya.......   Sema	Positive 
 Munnadi thamilda hindi ppl copy pannath ippo ulta aayidichaa	Mixed_feelings 
 Bhai hindi releje date batao na yaar	not-Tamil 
 Hindi me kyo nhi late trailer	not-Tamil 
 Oruthar mel ningga visvasam katerethekage, innoruthare yen asinge padetheringe	Positive 
 My dear 47k dislikers RIP,  verithanam varatum  anga papom.	Positive 
 1:31 yaarukaachu asuran padam niyabgathuku vanthucha	Positive 
 Bayagarama kathuvanga aamaians indha trailer paththu	Positive 
 silaiya odaikalam ana avaga sithandha odaika mudiyadhu... Periyar ambedkar... U1+PS+SIVA= Grand Blockbuster hit...	Positive 
 Dai Ranjith naaye ithu thaanda yenga thalaivar un caste kaaga thalaivar ra spoil Panna paatha	Positive 
 Theeran movie  fans hit likes....!	Positive 
 Dislike pannunavanla trailor ku pannala thala ku pannirukkanunga	Mixed_feelings 
 Seems like mission impossible Tom cruise	Negative 
 Marana Waiting Thalaiva + Makkal Selvan	Positive 
 Vikram look like Bryan in Tekken game!	Negative 
 dai thala pera sonnalay summa tamil naday athirum daa	Positive 
 Trailer ivolo kavalom padam Roma kavalom	Positive 
 andrala nama tamil peoples ah thappa pesunavan thana chai ... apave ivan mela mariyathai pochi..........	Positive 
 Yow mass yah. Kandipa theater la 3d odatha paapa	Positive 
 Shangar Sir ungalukku Thalapathi Fans Support Eppavm Erukkum	Positive 
 from 1:33 to 1:50 semma massssssss	Positive 
 Vijay sethupathiya nambathingaya avar movie ya aagidum climax la Vjs parak	Positive 
 Ithu kandit chinthamani kolakes pole thoniya malayalikal undoo??	Negative 
 Vijay sethupathi kaga indha trailer parthavanga la naanum oruvan......	Negative 
 I m big fan of dhanush	Positive 
 Thala love you... Yuvan bgm mass	Positive 
 enna padam yaa!! kola mass!! <3	Positive 
 intha pongal sema super ah iruka pothu	Positive 
 Enda potti pottu dislike panreenga haters	Negative 
 Unga mass yappo vooo engalukku theriyum	Negative 
 Thalaaivaa 🤟 Thalapathy Fans Like Hey 🤙	Positive 
 Get that slag naa enna meaning pa?	unknown_state 
 Vada Chennai 2 ku wait panravanga hit likes	Negative 
 Ennanga da views crash aiirucha romba neram ah appdiyae nikkidhu🤔🤔🤔	Positive 
 Isaac Asimov photo vechi irukkinga semma.	Mixed_feelings 
 Epdiyae ellarayum konnuptu neeyum seththu poidu	Positive 
