text	category
 Deiiii  ennada panni vachi irukeenga .....	Positive 
 3 Times kku mela pathavanga yarellam like pannunga	Negative 
 I am andra ajith big fan bro	Positive 
 Intha dhesiya viruthu Award Asuranukku Than.kandipla.Mass Ah varom.	Positive 
 Avengers end game a keduthan ippa director pariu kuduka pooran	Negative 
 Thalaivar enrum oruvar thaan avar Rajini Sir thaan.	Positive 
 11 maniku sollitu 10.30 ku vitanungaley	Positive 
 Dai intha mari padam already neraya paathachu	Positive 
 Aama Mr. Pandey inga enna panraru??	Positive 
 Apa kandipa thalapathy 64 miratta podhu	Positive 
 Vera level thalaivar tha eppavum mass	Positive 
 Innum one week trending la tha irrukanum	Positive 
 Oonkala ennaku pittikoum but romba thabana time la movie vittuthinka	Negative 
 Sathiyama solren!!!adichu underwearoda voda vitruven.pona manam thirupi varathu	Negative 
 Semma mass ahh iruku padatha release pannunga pa Wait panna mutiyaala	Positive 
 Bahubali 2 Vs   2.0🤣🤣 Rajamouli.  Vs  Shankar Maragatha mani Vs A.R.Rahman	Mixed_feelings 
 Super  super  super  rajani  mass ssssssssssssssssssssssssssss	Positive 
 Again again trailer pathute commands padikuravanga oru like podunga	Positive 
 Any PIGIL PANS... HIT LIKE....	unknown_state 
 Evana pakka Chinna paiyan marri irukkan ,,,,,,F*** girl	Positive 
 Climax music kekkumpodhu appdiye goosebumps start aagudhu.... thanks Yuvan Annnnnnnnnnnnnna	Positive 
 Pura aloga Chinta dhara ro cinema eta ku oscar trailer aka mili jiba kotha	Mixed_feelings 
 Thala king, getha vaa thala un rasikargal irukkanga	Positive 
 Trailer link ah  Therinjavanga ellarukum share pannunga fans	Positive 
 Anna nuvvu kottu super hit Ikkada andhraaaa Helo bros hit like here	unknown_state 
 Hit like for Action King Arjun Sarja.	Positive 
 Thalapathy fans yaaru nkp trailer pakka vantheenga	Positive 
 This is remake of pink hindi flim .... bigg boss abirami ka badhila tapsee ya vey potrkalam	Positive 
 #Neraiya  #Neraiya #Neraiya  #Neraiya #Neraiya  Thadava paathavunga #Like Pannunga #Bss	Positive 
 Phaa... Ithukey ipdinaaaa... Namba thalapathy ku epdi irukummmmm... Verithano verrithanooo	Mixed_feelings 
 794k likes first remake trailer getting this likes	Positive 
 Vijay sethupathi ma ma mass da....	Positive 
 Screen play veramari iruku yedo iruku idula	Positive 
 More than 20 times paathavanga mattum like pannunga..	Positive 
 Rajini Rajini tha style style tha......	Positive 
 Wow ...... Ye kadavula parthuta .. Yeppo periya screen la pappanu marana waiting	Positive 
 Apdila nadakkathu nadakka kudathu lovely THALA	Positive 
 Suyama sindhika terinja ovoruthanum super hero mass ya yo?	Positive 
 ayyo chance ah illa.. thalaivar acting pudusu pusa irukkupa... vera yaarukum indha madri settagadhu.... adi poli... merattitinga	Positive 
 Last dialogue  its true.... Thala superb	Positive 
 en thalaivan..engal thalaivan .nija vaalvilum avarai paarthavudan en kastangal panjai parandhu poividukiradhu..	Positive 
 Bgm ah enna da panni vachi erukega yelathuku semaah	Positive 
 Love u thalaaaaaaaaaaaaaaaa..... acting vera level Thala	Positive 
 Kola Gaandula irukken mavane odiru.. Phaah Dialogue delivery chancey illa..	Negative 
 rajini fans from Telugu states like here	Positive 
 Guyz support #2.0 India's pride	Positive 
 Views kammiya irukku yellaru parunga like pannunga...20m views avathu varanum...1m like varanum	Positive 
 Yaar Enna sonnalum ,Thala dhaan mass. Inga neraya Peru Namma Poola Umbarathukune varanunga	Negative 
 All d best from all Kannadigas....	Positive 
 Hollowed level la iruka rompa ethir pakkalam Vikram acting vera level	Positive 
 Kalyani priyadarshan.. nammada kochine oru like adiche....	unknown_state 
 Hindi la amitabku fight illa, Tamil Ajith ku la fight irruku	Positive 
 Ennada iron man elam vararu enya ildila pantringa ha ha ,,,	Mixed_feelings 
 Thala  oda lawyer acting ah pakka waiting ya..	Positive 
 Last BGM IS DANGAL.  DANGAL  SONG	unknown_state 
 100k like masss thala va va va va enum va	Mixed_feelings 
 ajith fans kaaga dhan last dialogue.....	Positive 
 We want this movie in telugu	unknown_state 
 Dai antha vijay cmku aasapaduran .Aana en thala eppayumae mass da .	Negative 
 Adei.. stop begging for likes... Idiots..	Negative 
 Thala fans anaivarum oru like podunga	Positive 
 Namata kadu iruntha eduthukiruvanunga Namata Kasu iruntha pudingikiruvanunga Ana padipu mattum nammakitta irunthu eduthakavemudiyathu............. Powerful dialogue	Positive 
 Yenda Thalapathy fans poole nereya peru umburinge	Negative 
 Hahaha poi bigil trailera paarungada🤭 vetti payalugala.	Negative 
 amaiku sangu confirmed adai Siva ha ha ha apidiye Feb odi poidu .. Illa 10 paisa paaka maata	Negative 
 Deiii movie eppa da waiting laye veri aaguthu	Positive 
 Thalaivan Verothanam Start Panntaru...Indha Diwali Nammaldhu Thalaivaa	Negative 
 Oruthar mela irukura visuvasathuku innoruthara yen asinga paduthiringa i think intha dialogue ellam fans kum suit agum	Positive 
 Sema pa trailer...inum neraiya neraiya neraiya neraiya thadava paknum pola iruku...!	Positive 
 Thalaivaaa . . .. . . marana paa... .. . .	Positive 
 Amithapbachan padattai rajiniku piragu tala panrattu eppadi nenaikkiravanga like podunga	Positive 
 Semma  THALA   veera  leveal   THALA	Positive 
 Padam nalla irukum yenna siva direct seiyala  aapppadi	Positive 
 GREAT FILM   BEST DIRECTOR   WELL ACTOR   MASS PRODUCTION	Positive 
 Aiyoooo intha manusanuku unmaiyave age enna nu therila pa epadi irukaru Thalapathy fans verithanam	Negative 
 6 la irunthu 60 vara RAJINI RAJIAYAM.....	Positive 
 movie unlike adikunnadhu enthinanennariylla kandavarkkariyam movie ethra thrilling anennu	Negative 
 Ippo sila paithiyanga like or comment nu kelambi irukumea	Mixed_feelings 
 Ithu padam mathiri illa graphics mathiri irukku	Negative 
 Rajini nale mass than pa	Positive 
 Dhanush + Vetrimaaran + GV	Positive 
 Mrg elunthathum bathroom pohama pakravanga like podathinga.. Poi velaya parunga..	Positive 
 thirunelveli enga thala yoda kotta daa	Positive 
 Ena da trailer ye mokka pundai ya iruku	Negative 
 Haa bhai kidr gye vo log jo bolre the teaser ghatiya hai iska VFX faltu hai issss flimmm ke	not-Tamil 
 Trailer maranna mass  thalaivar therika vidrarruuuu	Positive 
 I hate v... s...  Iron man kill it v... s	Negative 
 Rajini  sir Teaser Super.. indha pongalukku Petta than gethu....I like this Flim	Positive 
 Yaru padam vanthalum varadum thanush Anna padam vanthale tamil nade miratdum by thanush veriyan	Positive 
 Sivakarthikeyan Telugu fans like	unknown_state 
 Telugu dhanush fans hit like here	Positive 
 Rajini super star next c m 2. 0  pe Super	Positive 
 Rajini tha mass vj ajith lam tusu	Negative 
 Semmma maasss.. Thalaivar style.. .. Super thalaiva.. 🤘🤘	Positive 
 You kena tunggu lebih lama lagi untuk tosai...	not-Tamil 
 Dhanush vatri maraan fans like it	Positive 
 0:26 & 2:18 Goosebumps... Onre Onru Mattam... Thalaivar... Rajni	Positive 
 semma mass great Shankar sir super star rajini great	Positive 
 Kabhi kabhi to lagta hai south waalon ki language sikhlun.	not-Tamil 
 Our super hero siva anna forever	Mixed_feelings 
 Intha acting ku thala ku Oscar award kadaikum	Mixed_feelings 
 Endha trailer  time sollamatte 200 time melle pathavange mattum like podunge	Positive 
 Nee enna captain America va ?	Negative 
 Bigil  Kaithi Yar yar 2 padathukume waiting	Negative 
 H VINOTH  macha u athukkum mele	Positive 
 dislike because of rajini speech in thuthukudi	unknown_state 
 G. V. Neenga music mattum pannunga thevaillama hero va nadikkathinga	Positive 
 Thalaiva  Makkal selvan Annan	Positive 
 Ajith fans innum naraya naraya naraya trailer paakkanum...	Positive 
 Sammaya iruku!! Thalaya indha maari role la pakka dha nalla iruku romba naal kezhichi	Negative 
 #Yuvan Shankar Raja# Raja mean king .. you are the real bgm king  #Bgm Vera Vera Vera level yaa#	Positive 
 bgm terikkuthu ghibran   from 1:05	Positive 
 Semma style mass rajini is rock	Positive 
 Appadaaa... Oru wela Thala Fans Siva kita irundu thappichitanga.. 🤣🤣🤣🤣	Positive 
 Orutar mela visuwasam kaaturathukage innurature yen asinge paduturinge... semmmmmaaaaaa	Positive 
 Neraya Neraya Neraya Neraya kola mass thala	Positive 
 *tha.. VERA level...!  Saavardha irundhaalum Poraadi saavanum... Kaal la vizhundhu Saaga kudaadhu..!!! GOOSEBUMPS dailogue	Positive 
 Kaidhi oodha poran da vijay ku bhigilu va va va sanghu	Positive 
 Last dialogue semma  karthi Anna .... Nala panirukenga ....	Negative 
 Itha trailer Ku dislike pannuraven girls ku against ta irupan pola.... You mom also girl..	Positive 
 Theme pathutu thaan again paaka vanthan thala ya	Positive 
 Enna Da Hindi a paarthu trailer I kooda copy adichi irukaanunga	Mixed_feelings 
 padam vera level hit aagum nu solravanga hit like here	Mixed_feelings 
 Balaji shaktivel fans like ah poduga	Positive 
 Oruthar mele visvasam kattathukkake innoruthare yen asinga peduthirenge	Positive 
 appo visuvasam  lolzzzzz rombo pavam ajith lolzzzzzzzzzzzzzzzzzzzzzzzzzzzzzzzzzzzzzzzzzzzz	Negative 
 savuratha irunthalum sanda pottu savanum sir payanthu kal la vilunthu sava kudathu sir... super dialogue	Positive 
 Dislike potavangala *tha neengala manusangala ,	Negative 
 Fight scenes &  bgm vera level nu soiluravaga ................	Positive 
 Asuran vettai aramam marana mass	Positive 
 Kamarajar ayya va tholvi adaiya vaitha tamilnadu thana ongkaluku last vara oru nalla thalaivar kuda vara mattan da	Negative 
 The word vera level thalaiva unaku vayase agadha paaaa	Mixed_feelings 
 Kola kandula irrukam veral level mass thalaiva	Negative 
 Ivaruku Intha vaisula agathu pola... Omg wattta a man thalivaaaaaaa	Positive 
 Thalapathy 64 kkaa vanthu intha trailer pathavanga vijay fans like podunga .........🤞	Negative 
 Vagina fanskala savunkada... Thalaivar Kodi parakura edathula Vera Evan kodida parakum	Negative 
 Nee va thala eppavum unaku viswasama irupom... love you thala	Positive 
 Aiiiii Black Sheep Ayaz  & kutty munji !! semme  ! valthukal	Positive 
 1st tym ungaal ipdi pakro Thala 🤘🤘	Positive 
 Nerkonda parvai...  Sema sema sema trailer	Positive 
 en cmnta evanum mathika porathula,so nice..	Positive 
 Enagada ipdi padathula marana katu katirukinga	Positive 
 congrats chiyaan Anna I m thala fan	Positive 
 Yenna da last seen ha phone la potrite mode la yedutha maari irruku	Positive 
 Bollywood wale yaha hagne na aye	Negative 
 Vera Vera Vera level!!!!!!  Umma!!!	Positive 
 copy bgm ...to malayalam film oppam	Negative 
 omg, Indian filmmaking is so embarassing xD	Positive 
 Petta padam vettri pera Thalapathy rasigargalin valltukkal.. Endrum vettriye todarum..	Positive 
 Mass thailava bgm Vera level and dialogues semma	Mixed_feelings 
 Wow thalaivaaaa Vera Leval Teaser  Awards Eduthu Vaikadaaa Asuran Vararuu	Positive 
 Maranam dance thalaiva u r great	Positive 
 Enda en deivatha dislike pandringa thevudiya pasangala.yaru sottula manna pottaru . savungada prostitute pasangala	Negative 
 Thalaivar pongal begins 🤘🤘 petta paraak	Positive 
 Thalaivaa kola mass Vera leavel	Positive 
 I don't know Tamil but I like Rajini. Super style.	Negative 
 Kola kandula irukan movanaeee kollama Vida matan	Mixed_feelings 
 semmmaaaaa massssss trailer a summa verithanam.	Positive 
 Anyone still watching in may 2019?	unknown_state 
 Pink 73k likes only... But, NEER KONDA PAARVAI......AWESOME....	Positive 
 Dhanush vera maari idhu veri maari	Positive 
 Yanada....last la... Bigil ku ... Reply pana..maari irukayy 🤣🤣	Negative 
 Sivakarthikeyan Anna real fan's her like ....,	Positive 
 THALAIVAAAA  VERA LEVEL YA	Mixed_feelings 
 Nice 🥰🥰🥰... But rekka... Sindupath Mari irukama iruntha seri	Mixed_feelings 
 Last word in Malay 'you kena tunggu lebih lama lagi untuk tosai'	Positive 
 Morning lindhu trailer pathuttu yavalo comment like pathutte erukravange like podunge	Positive 
 Dialog : க‌ல்வி mattum yaralum nammata eruthu aaduthuka mudiyathu.. Vera lvl	Positive 
 vera level thala, en channel ku oru sub podunga thala veriyarkala, ungaluku kodi nandrigal	unknown_state 
 thalaiva unna paathona uyir poiyudichu...yenna Mazz,yenna class,yenna style...RAJINISM CONFIRMED	Positive 
 Thalaivar      Veraaaaaaa level	Positive 
 Family yoda padam parka mudiyathu pola.....	Negative 
 Thala lookku sema mass nu soldravanga mattum oru like podunga	Positive 
 Wow semmaya iruku sk anna fans hit	Positive 
 Peeta best or visuwasam best peeta best na like pannuga visuwasam best na dislike pannuga	Positive 
 pongalukku  petta paraak thaan thalaivaa back with bang	Mixed_feelings 
 Omg thalaivaar pandey erukaraa vera level la eruku padam	Positive 
 Petta  poteringala anna end lover kanti please anna	unknown_state 
 Shraddha shrinath fans from Karnataka hit like here.....	Positive 
 Hindi me kab release hoga plz comment	not-Tamil 
 tvaivaal aaaa aaaaaa vera level tvaivaal aaaa	Positive 
 Vera level Trailer  thala pola varuma  luv u thala .....	Positive 
 Rajini Sir and Nawaz Bhai! Can't wait!!!!!	Positive 
 Indha padam KGF vida semaiya irrukunu ninaykiravanga like podunga	Positive 
 Ennaa daa sedhukki vechirukkeenga frame by frame...	Positive 
 After a long time Thalaivar look...yeppaa...semmaaa...  Vere leaveldialoge vere leavel  anirudh bgm vijaysethupathi..mass total.. petta.... kola mass...doiii...	Negative 
 Kola kandula irukan mavane kollama vidamatan hit like hera	Positive 
 Trailer merala aticithookuthu ellar vayil veralavaikuthu	Positive 
 Bgm na idhan bgm. Yuvan on	Positive 
 Rissing Star SK eppavum Trending Star	Positive 
 Awesome  Rajni na summa va	Positive 
 unmiyana Thala fan like a potutu po	Mixed_feelings 
 Suyama sinthika therinjavan than MANITHAN. .....super hero illa sk. Ni seekrama  anchoring ku again vara pora..	Negative 
 Super Shankar Sir Rajanikanth Sir All The Best Movie Team Waiting Movie From Pawankalyan Fans	Positive 
 தலைவா  Vera level Tha podra vediya	Positive 
 Paavam sk Anna last movie nalla pola intha movie hit aaganum ragavendhra swamy Kita vendikara	Negative 
 Yow.. editor trailer yeh mukkavasi story solitiyeya...	Mixed_feelings 
 Sona time la trailer gethu bigil uuhhhuuuu sangu oothaaa	Positive 
 I'm vetrimaran fan padam semma irukkum	Positive 
 Massss vera level  ASURAN Panthayam adikum	Positive 
 Dhaush Nadipuku Intha padam Theeni podum nu ninaikuren	Positive 
 Padam trailer mooka, padamum waste Insulting amitab  Poi sethu thola da ajith sunni	Negative 
 Really super epdiya ivlo irku 37 days la mudicha	Positive 
 Action king mass hero   1990s kids yarelam avanga solunga avaru mass ahh illaiyanu	Positive 
 Bgm sounds like Va modhi paru theme from Nerkonda paarvai..	Positive 
 Albod galbod tolvad eeafhta fsadi bangsudsev tonytwag fortesgte	not-Tamil 
 Telugu lo kuda release cheyavachhuga machha	unknown_state 
 Vjs poda iron man ah keduthavane loosu	Negative 
 pangaaligala intha vegam paththaathu innum vegama likes ah therika vidunka	Positive 
 Thalaivaaaaaaaa.. pakka mass. Invincible style samrat	Positive 
 Bgm like nkp theme va modhiparu🤔🤔	Negative 
 32K Like Potavan Silukku Mavan	Negative 
 Click like botton  Still repeat mode from 6pm	Positive 
 #என்றும்_தலஅஜித் #NerkondapaarvaiTrailer Crossed 11 Million Views.	Positive 
 Vera level mass mass ajithkumar	Positive 
 Ippadi  neraiya neraiya neraiya neraiya ....	Positive 
 Rajini screen la  semma jore ah irukaru super	Positive 
 Padam Raava irukkum pola  best of luck Thanush	Positive 
 Thala rasigan in vayalur pudhunagar SHACKARSH	Positive 
 Vfx pathi ippo pesungada Hollywood sambranigala	Negative 
 Final dialogue  for both Thala & Thalapathy fans ku solirukaru pola...	Mixed_feelings 
 Marana mass trailer....... Trailer na ippadi irukanu	Positive 
 Challenge summa therikavidapothu Chiyaan fans like pannunka	Positive 
 Shankar sir we want anniyan 2	Negative 
 I'M WAITING SANKAR ANNNA NEXT ANNIYAN 2 DIRECTOR SHANKAR CHIYAAN VIKRAM FANS VERY SOON ATHUKKU ME LA	Positive 
 Vera Vera Vera level. Thalaivar maaaassss	Positive 
 Movie fullaa night la mattum shoot pannittanga pola...🤔	Mixed_feelings 
 Dislikes podura thevidiya kandara oooooooli pasangala	Negative 
 Ghibran pundaya vitta ungalukku vera aale kedaika laya da.	Negative 
 NORTH OR SOUTH KGF IS THE BEST!!	Positive 
 SK Anna  sema Mass	Positive 
 Nalla thana da iruku..  yendaa veembuku nu dislike panringa..	Positive 
 Malaysia Tamil fans waiting for Kadaram Kondan movie Chiyaan Vikram, Kamal Haasan fans hit like here	Positive 
 Inspector gadget movie pakkura pola iruku	Mixed_feelings 
 Waiting waiting waiting super star rajini kanth sir first days 4 time pakka waiting	unknown_state 
 Har bar alag look yr ohsame only one man Vikram	not-Tamil 
 THALA semma MasSs Girls mukiyamana movie  don't miss	Positive 
 Ethu vera vera vera vera  level trilore	Positive 
 Good luck from THALAPATHY fans kerala	Mixed_feelings 
 thalapathi nadichaa veru sura Aana danush nadichaa asuraa da varuvaaru paaru	Positive 
 Superbbb Rajini 20 years Boy  telugu lo kuda Kavalli	Positive 
 Nanum padipa eduthukalanu patha.Mandala yeramatengudhu, correct dhanush sir	Positive 
 Makkal : Rajini padam nadikiradha niruthu, illaina un dowser'a kilichi ammanama vitruvom, Maanam pona Arasiyal side'aey vara mudiyaadhu paathuko	Negative 
 Enna elavu da idhu .... indha karumathuka 500 kodi	Negative 
 Vikram, Surya, Dhanush... Ivanga moonu perukum oru hit theva paduthu 🤪🤒🤒🤒🤒🤒	Mixed_feelings 
 VIJAY SETHUPATHI POWER  19 VIEWS BUT,,,,,,,,,,,,,,,,,,,,,,,,, 185 LIKE	Positive 
 Looks like hollywood James Bond... Movie. And vikram sir u r da best one in our tamil industry...	Positive 
 adapaveegala ipdi nadikura manushana vachu flopah kodutheengalada .  ajith sir pls  choose new directors	Mixed_feelings 
 Thalai ku thalai poora Neraiya Neraiya Neraiya romdha Neraiya neracha mudi irruku	Negative 
 Kaadu iruntha eduthukuvanunga, kasu iruntha pudungikuvanunga, Ana padippa mattum orthankitta iruntha  edukka mudiyathu dialogue vera level	Positive 
 Mm mm kr kr haa ha ha haaa  haiyoo aiyo	not-Tamil 
 Ipa enna panna porom... Viral Aaka porommmmmmm	Positive 
 No actor can replace like rajni sir	Positive 
 Wow   Super Star  RajiniKanth Fan's  like Vesukondi   ట్రైలర్ అదిరింది	Positive 
 Vera level  la iruku  . . .  Inga konjam payama than iruku  . . Accept	Mixed_feelings 
 Tamil shankar.. Hindi rajkumar hirani...Telugu raja mouli... R tge best	Positive 
 Nala eruku nalatha eruku adaaa nalathayea eruku	Positive 
 Sweet sapda porom pongaluku  Petta parak	Mixed_feelings 
 Thalaaa  u r  great	Positive 
 Teaser super nu solra thalapathi rasikarkal like pannuga	Positive 
 Vera level ..after long time  sk fans	Positive 
 R.I.P Enai Nokki Paayum Thotta	Positive 
 Climax scene la kan kalangunavanga like pannunga	Mixed_feelings 
 Raashi khana va mokka pannidhadinga Nevetha pethuraj heroine na pottu .appuram padam flop dhan	Negative 
 Pandee pesum pothu.. Thala ukkarra sangi pundannu solliruntha weight ah irunthurukkum	Negative 
 Awesome movie shot I like this	Negative 
 2019 hig thriller movie .. king maker Ajith kumar..	Positive 
 6.7 M views and  681k likes	Positive 
 Finale dialogue ella fans kum porundhum	Positive 
 Yuvan thala rasikar like therikka viduka	Positive 
 Like hit superstar rajni kant sir  Akhsay sir and shanker sir  Like hit	Positive 
 Namaku yadhuku indha tava illadha vala...  Mr. Ram...	Negative 
 Hindi me dub huyi hai kya	Positive 
 Dhanush acting verithanam nu soldravanga like panunga	Positive 
 Thalaivar Marana Mass ATB..pppaaaa...no words to say... ayyo...ayyo... wow... hmmmm...	Positive 
 Thala da Kolla mass Nkp Trailer	Positive 
 Ennangada cmnt full ah ...matha state aalunga tha irukkangavjs	unknown_state 
 Eppothum nambe than likes kude,, dislike kum nambe than kude	Negative 
 Mass iruku eppo entha padam varum I love u vikram	Positive 
 its just like a hollywood movie.wow	Positive 
 Evan sonnadhunnu theriyala tamilanukku talant paththathunu.....always Tamil people talented	Positive 
 2020 oliymbic india gold varuma silvar varuma parunga.	unknown_state 
 Hollywood level la padam kettavanga lam... பாருங்கோ பாருங்கோ	Negative 
 Kappan veda  VARA LEVEL movie da Indian Bruce Lee dhanush Anna	Positive 
 Sivakumar - Sketch (promo) andha hospital ku illa 2.0 ku	Mixed_feelings 
 Yen Anne yen ipdi pannitiye release panradhu konjam kuda solllame che	Positive 
 My god power star Pawan Kalyan remakes this movie .....jai power star jai JANASENA	Positive 
 Good  morning  Thala fans.... Trailer semma ya irukunu..... solluravunga hit like.......	Positive 
 Ppa Vera level veri yerutu idhu than marana mass	Positive 
 Andha old style inumm Konjam kooda Pogala ...Apdiyae irkuu ya	Positive 
 Valthukkal enrum thalapathy rasikan samayan MADURAIkaran	Positive 
 Thalaiva Rajini sir fans hit like	Positive 
 Pink padam paathuthaen hd print irruku yaaruku veanum	Positive 
 Karthi thevidiya magane nee ellam edhuku da cinema industry irukka pooi thooku pottu sagalam da intha pollapukku	Negative 
 Real life HERO SIVAKARTHIKEYAN.. ippo Reel life la yum HERO aagitaaru	Positive 
 Ithella ennada hollywood pado enga aalu siva etuthaaru paarraa vivegam pado athu maari oru pado ungalaala etukka mudiyuma aa	Mixed_feelings 
 Oru thar Mela viswasam kaddurathukka ka enni oru thaingaala eathukku Asikingaa padduthiringaa ...#Nkp	Mixed_feelings 
 I love sivakarthikeyan  Sivakarthikeyan fans like pannunga	Positive 
 Sweet super ra  eruku thalaiva  Tirupathi Thalapathy fan	Mixed_feelings 
 Ninga arjun fan ah iruntha oru like podunga	Positive 
 U1 rock but 1.05 irumbuthirai bgm maathurie iruku	Mixed_feelings 
 Enda itha trending la podala, somberi Youtube pasangala	Negative 
 October maasam Kala kattum pola asuran & bigil	Positive 
 verithanam maxx , dislike pannavangellam yarunu ellarukkum theriyum, burnol	Positive 
 Kamalah kanu aprm endah perah munadi podringah?	Negative 
 *Kajal  Fans Subscribe *	Positive 
 Ayyyo thalaialva Vera lvl confirm ellaflrume RAJINIFIED	Positive 
 Thala un padathukku verithanama kaathirukkirom ,makkalaagiya nangal,iam waiting this movie thala.	Positive 
 Reached 10m views superb Thala always mass Vera level enum neraya neraya neraya neraya neraya .	Positive 
 Ayoo vanthuruvanga Ithu like panu athuku like panu nu 🤐🤐	Negative 
 Thanks karthik sir...annamalai part 2 parthamathiri iruku..rajini sir spped, cute ness, mass...chance ah illa...thanks karthik subburaj...	Positive 
 Die hard Chiyaan Vikram Fans nu Like adikkan olla comment..  Love from Kerala..	Positive 
 Padam pattaiya oda pokuthu ellarum ready aakikonga thalaivar thalaivar thaanya	Positive 
 enna achchi sakar sir no good	Negative 
 Like potutu video potavanga yar yar...	Positive 
 Heroine illatha oru moviea .appa semma hit thaan.	Positive 
 Last walking moment mass ah iruku	Positive 
 Sasikala K  mass  thala	Positive 
 namma kitta iruthu padipa mattu yeduka mudiyathu chidambaram	Positive 
 Its going a blockbuster....  deepavali powlikkum..	Negative 
 Enga da trending la varala .. Youtube ???	Mixed_feelings 
 I am thalapathy fan neenga parunga neenga tha win panna poringa  I am waiting to thalaivar movie Petta paraakkkkkk	unknown_state 
 Iam surya fan but i like trailler awesome trailler..തല സൂപ്പർ ആയി	Positive 
 Thala thaanda eppavume gethu meethi ellaarum waste	Positive 
 sam c vikram vedka thema vidamaatru pola irukku.	Mixed_feelings 
 Intha movie la yaru hero ???	Positive 
 Ajith sir act like amitabh in pink	Mixed_feelings 
 2017 dec-velaikaran -block buster.  2018 dec-kanna-hit.  2019 dec-hero block buster..  like frds	Mixed_feelings 
 Some 1 : Intha mathri ponungaluku ellam ipudi thaan nadakum   Thala : nadaka kudathu ...!!!	Positive 
 Parkathukku munnadiye pottathu nan mattum thana....?	Mixed_feelings 
 ஐயயோ நீ நல்லாயிருக்க - semma cute. idha repeat modela pathuketta iruken	Positive 
 Kabali, kaala.. idhellam success pannaliyaa!! Adey madiri kattayam indha mokka padattitum vetri padamakkuvom	Mixed_feelings 
 Padayappa, badsha, muthu padangalin varisayil petta paraak Thalaivaa trailer kadaisila kali oda attam super intha pongal thalaivaroda pongal	Mixed_feelings 
 PETTA pongal Da Thalli Nilunga Kosuvasam BOYS	Positive 
 ippo enna panna porom? sweet sapda porom	Positive 
 Kola gaandle irukken kollame vida mate.. Thalaivaa..!	Positive 
 Valimai varatum  enge attam adule paapingge	Positive 
 I am chitti...... Reloaded... Version 2.0	Negative 
 1 million likes vara matignkitheeee so sad	Negative 
 Kaidhi vere leval.... bgm mass mass massssssssssssss	Positive 
 Idhaanda thala......🤩🤩 Kadaisiya ennai arindhal la parthathu...	Positive 
 I wonder Why dis video s not trending ???	Mixed_feelings 
 Iruku.. Oru nalla comedy padam waiting la iruku. SK🤣	Negative 
 മലയാളി ഉണ്ടോ ഇവിടെ Namakku thevayanatha namma than adichu vaankanum	Positive 
 Get to 1 million likes fast please.	Positive 
 Vera Level  Look THALA 🥰	Mixed_feelings 
 This is Thalivar padam .....marana mass u u u u u u u ........	Positive 
 Kaayam vena aari irukkalam but vadu innum marayala- i'm hardcore iron man fan	not-Tamil 
 Nammaku thevayanatha namma than adichi vanganum...	Positive 
 74 K comments , 820 K likes.....	Positive 
 டே YouTube 2 days enkada iruntha....fraud.....	Positive 
 Makkal Selvan nu solradhuku badhil makkalin Selvan nu sollalaam	Positive 
 Pigay pans be like....pink movie dubbing daw daw daw..,🤣🤣🤣🤣🤣🤣	Mixed_feelings 
 Dislike potavanaga nenga irukara varikum nanga inum mela mela poovm da Thala daaa	Positive 
 ungaluku vaiyasagala...solli 15 varusam irukum....rocking thalaiva....	Positive 
 Entha padam velangathu da nasama poidum da	Negative 
 Vadivelu styla sollanumna Engada inga iruntha phona kaanom	Positive 
 Please dub to Kannada language Vijay setupathi sir....	unknown_state 
